party,year,pattern,match,sentence,protocol_id,is_correct__fill_in
C,2014,hen,hen,"Man känner kanske inte heller att man deltar i en värdegemenskap. Särskilt viktigt blir det för den som kommer hit från ett annat land att känna att man är fullt ut respekterad, att lagen, att Hans Majestät, att statsministern tillerkänner honom eller henne samma och lika rättigheter just utifrån att hen är en person som uppfyller medborgarskapskraven. Fru talman!",H109116,
C,2014,hen,hen,"Man känner kanske inte heller att man deltar i en värdegemenskap. Särskilt viktigt blir det för den som kommer hit från ett annat land att känna att man är fullt ut respekterad, att lagen, att Hans Majestät, att statsministern tillerkänner honom eller henne samma och lika rättigheter just utifrån att hen är en person som uppfyller medborgarskapskraven. Fru talman!",H109116,
C,2014,hen,hen,"Huvudmannen, i den mån denne är förmögen att bestämma och kommunicera sitt val, ska ha inflytande över vem som förordnas. Personens lämplighet och förmåga att utföra sitt uppdrag måste kontrolleras noga, dels för att kontrollera så att inga intressekonflikter föreligger, dels för att se till så att hen är lämplig och kan utföra uppdraget att företräda sin huvudman och verka för dennes bästa. I uppdraget att företräda och förvalta egendom krävs ibland särskild erfarenhet.",H109130,
C,2014,hen,hen,"För Stefan Löfven, ivrigt påhejad av Jonas Sjöstedt, är företagaren skurken. För oss är hen hjälten. Jag vill därför fråga Stefan Löfven: Varför är nationella investeringsplaner och en industrikansler bättre politik än att fortsätta att sänka kostnaderna och minska krånglet för landets småföretagare och entreprenörer?",H2098,
C,2015,hen,hen,"Vi tänker oss power-to-gas, pumpkraftverk och annat som kan behöva ett extra stöd för att komma igång och skapa tekniken som vi sedan kan använda för att minska effektproblem och annat. Energilager handlar för oss inte bara om att den enskilde konsumenten ska kunna lagra sin egenproducerade el för att använda när hen sedan behöver den mer. Det handlar om så otroligt mycket mer, för det finns så många fler nyttor med energilagren.",H30942,
C,2016,hen,hen,Ministern säger i svaret att det inte är ett problem som föranleder åtgärder att vi har ett spårbyte i ett fönster under två veckor efter avslag på asylansökan. Ministern säger att ett tillfälligt uppehållstillstånd blir permanent om hen kan försörja sig genom arbete. Ministern säger också att sökande av uppehålls- och arbetskraftstillstånd från hemlandet för att komma hit inte heller utgör anledning att vidta några åtgärder.,H309101,
C,2017,hen,hen,Nu höjer regeringen skatten för småsparare. Med Vänsterpartiets politik ska undersköterskan betala mer i skatt på de slantar som hen sparar av sin lön och på den buffert som hen försöker att bygga upp. Det är nämligen den exakta konsekvensen av att regeringen nu höjer skatten på investeringssparkonton.,H50915,
C,2020,hen,hen,"I valförordningen regleras vilken storlek valsedlarna ska ha, vilken papperskvalitet de ska ha, att färgerna ska vara gul, blå och vit och vem som ska tillhandahålla alla valsedlar. Sedan valet till Europaparlamentet förra våren är det också möjligt för väljarna att på valsedlarna skriva namnet på den kandidat och det parti hen önskar rösta på. Till 2018 års val trycktes, enligt Valmyndigheten, ca 673 miljoner valsedlar, vilket motsvarar ca 83 valsedlar per röstberättigad.",H709136,
C,2020,hen,hen,"Regeringen bemyndigas med dagens beslut att lämna respektive ta emot operativt militärt stöd. På begäran av Finland ska svenska styrkor – kvinnor, män och hen – sättas in för att hindra kränkningar av finländskt territorium, och Sverige kan på motsvarande sätt begära stöd av finländska styrkor på vårt svenska territorium, förutsatt att landet inte är i krig eller att en väpnad konflikt råder, för då är det riksdagen som fortfarande har att fatta beslut. Här finns inga ömsesidiga försvarsförpliktelser.",H8093,
C,2023,hen,hen,"För att vi ska få ett land som håller ihop krävs även politiska beslut som gynnar glesbygden, bland annat. Den som besöker ett servicekontor ska känna sig trygg i att berätta om vad hen vill ha hjälp med där. Den som besöker ett kontor ska kunna bli förstådd på det språk hen talar, och den som besöker ett kontor ska också få samma service där som på ett annat kontor som hen besökte veckan innan.",HA09124,
C,2023,hen,hen,"Den som besöker ett servicekontor ska känna sig trygg i att berätta om vad hen vill ha hjälp med där. Den som besöker ett kontor ska kunna bli förstådd på det språk hen talar, och den som besöker ett kontor ska också få samma service där som på ett annat kontor som hen besökte veckan innan. Tyvärr ser det inte riktigt ut så i dag, vilket framgår av Riksrevisionens granskning.",HA09124,
C,2024,hens,hens,"Är det barnen som ska straffas för att vi inte har tillräcklig bemanning nattetid som kan skapa lugn även då? Att låsa in ett barn på hens rum nattetid är inte förenligt med barns rättigheter; det måste vi komma ihåg. Men, herr talman, även jag och Centerpartiet ser tyvärr att vi behöver ta tag i detta i dag, även om begränsningsåtgärder ska vara sista utvägen för att skydda barn och unga.",HC0943,
C,2025,hen,hen,Varje person som kommer är ett potentiellt problem till dess att motsatsen är bevisad. Personen måste alltså visa att hen är hederlig innan hen blir accepterad. För mig och Centerpartiet är det tvärtom: Varje människa är en resurs.,HD0945,
C,2025,hen,hen,Varje person som kommer är ett potentiellt problem till dess att motsatsen är bevisad. Personen måste alltså visa att hen är hederlig innan hen blir accepterad. För mig och Centerpartiet är det tvärtom: Varje människa är en resurs.,HD0945,
C,2025,hen,hen,För mig och Centerpartiet är det tvärtom: Varje människa är en resurs. Jag utgår från att en person som haft kraft att fly från förtryck för att rädda sig och sin familj också både vill och är beredd att ta ansvar – ansvar för sin familj och för sin försörjning men också för att bli en del av det nya samhälle som hen bor i. Det är bara att gå till sig själv.,HD0945,
KD,2013,hen,hen,Herr talman! Sara Karlsson har frågat socialförsäkringsministern om hen avser att lägga fram ett förslag i enlighet med utredningen och hur det i så fall motiveras. Arbetet inom regeringen är så fördelat att det är jag som ska svara på interpellationen.,H10924,
KD,2015,hen,Hen,"Låt mig återge vad den person som var regeringens representant, en statsinspektör vid Livsmedelsverket, sa. Hen uttryckte sig enligt följande: Min instruktion var att jag skulle lägga ned rösten utan att ge en röstförklaring. Och hen fortsätter: Sverige har alltid gått på den vetenskapliga linjen, och i det här fallet har jag bara en instruktion att följa från departementet.",H20950,
KD,2015,hen,hen,"Hen uttryckte sig enligt följande: Min instruktion var att jag skulle lägga ned rösten utan att ge en röstförklaring. Och hen fortsätter: Sverige har alltid gått på den vetenskapliga linjen, och i det här fallet har jag bara en instruktion att följa från departementet. Det är helt enkelt att vi inte har följt den vetenskapliga linjen, som varit brukligt i Sverige.",H20950,
L,2013,hen,hen,"Vilka insatser som ska ingå i planen avgörs utifrån individens behov och förutsättningar. Målet är att varje individ ska få det stöd hen behöver för att så snabbt som möjligt lära sig svenska, komma i arbete och klara sin egen försörjning. Som Raimo Pärssinen påpekar i sin interpellation går vägen till arbete för nyanlända ofta via utbildning.",H00963,
L,2016,hen,hen,"En person söker en fristad i ett annat land än sitt hemland. En flykting är en person som befinner sig i ett annat land än det som hen är medborgare i därför att hen känner välgrundad fruktan för förföljelse på grund av ras, nationalitet, religiös eller politisk uppfattning, kön, sexuell läggning eller annan tillhörighet till en viss samhällsgrupp och inte kan – eller på grund av sin fruktan inte vill – söka skydd i sitt hemland. Vi liberaler anser också att hbt-personer, alltså homo-, bi- och transsexuella, som söker asyl i Sverige inte ska nekas det för att de har varit tvungna att på grund av fruktan dölja sin sexualitet i hemlandet.",H30987,
L,2018,hens,hens,Det behövs en maktförskjutning till patienternas fördel inom hälso- och sjukvården. Patienten ska ha rätt att vara delaktig i utformningen av sin egen vård och ska därmed ha rätt till hälso- och sjukvård som i större utsträckning tar hänsyn till hens önskemål och förmåga. Det är mänskliga rättigheter det handlar om.,H50981,
L,2018,hen,hen,"Därtill kan en person få tidsbegränsat uppehållstillstånd om han eller hon studerar eller har för avsikt, som det heter, att studera på gymnasiet, komvux eller en yrkesutbildning. Det innebär att en person endast behöver uppge att hen har för avsikt att studera och inte att personen de facto gör detta eller verkligen kommer att göra det. Lagrådet framför tydlig kritik också mot denna del av lagförslaget.",H509125,
L,2020,hens,Hens,"En disputerad sjuksköterska får inte försvinna till akademin. Hens kunskap och forskning behövs nära individen, nära verksamheten och inte minst nära patienten. Fru talman!",H709118,
L,2021,hen,hen,Socialdemokraterna har mot sin vilja skrivit in i svensk lagstiftning att en person inte ska behöva vare sig styrka sin identitet eller göra den sannolik. Jag tror att det för väldigt många framstår som något apart att Sverige som stat i sin lagstiftning ska skriva in att vi uttryckligen inte anser att en person som ska ges uppehållstillstånd i Sverige ska behöva klargöra vem hen är. Därtill lade man nu fram förslag att en person ska kunna få uppehållstillstånd eller till och med permanent uppehållstillstånd i Sverige enbart på basis av till exempel yrkesintroduktionsanställningar eller lån hos Centrala studiestödsnämnden.,H809146,
L,2021,hen,hen,"Så länge personer utsätts för sexuella trakasserier på sin arbetsplats behövs en diskrimineringsombudsman som kan utöva tillsyn. Så länge någon kan bli av med affärer för att hen är homosexuell, avskedad för att hon är gravid eller trakasserad på grund av sin hudfärg behövs en diskrimineringsombudsman. Fru talman!",H90944,
L,2022,hens,hens,"I Göteborg har vi ett liberalt kommunalråd. Det har varit en av hens prioriteringar att just avsätta resurser till läromedel i kommunens budget. Det är en besjälad uppgift, om jag får säga så.",H90995,
L,2022,hen,hen,"De olika delar som finns i utredningen kompletterar varandra på ett heltäckande sätt. Jag välkomnar att det också finns en tydlig utskottsmajoritet för en skärpt lagstiftning mot så kallad eftersupning, alltså att en rattfull person efter en trafikolycka hävdar att hen har druckit alkoholen efter olyckan och inte innan. Man får då föreställa sig att föraren alltid åker omkring med en fickplunta i handskfacket för att lugna nerverna.",H90999,
L,2023,hen,hen,"Vårdens villkor är i allra högsta grad en jämställdhetsfråga. Varje anställd i sjukvården ska veta att hen, eller som det oftast är inom vården – hon, har tillräckligt med kollegor. Den nya regeringen har gjort budgetsatsningar på kompetensutveckling och kompetensförsörjning och satsningar på vidareutbildning för sjuksköterskor och bättre utvecklings- och karriärmöjligheter.",HA0971,
L,2023,hen,hen,"Det behöver ligga högre. Det pågår ett arbete på grund av EU-direktivet att målet ska ligga på 40 procent, men jag är övertygad om att en ledamot i en bolagsstyrelse vill sitta där först och främst tack vare sin kompetens och inte för att hen är inkvoterad. Det finns otroligt många dugliga personer av båda könen inom det här området.",HA0971,
L,2023,hens,hens,"För några veckor sedan beslutades det om en lagrådsremiss i vilken det föreslås en förstärkning av det straffrättsliga skyddet för båda dessa grupper. Brott som begås mot en person på grund av att hen har bedrivit journalistik eller mot en person med en samhällsnyttig funktion i hens tjänsteutövning är ett angrepp inte bara mot den som utsätts för brottet utan i förlängningen även mot demokratin och samhället som sådant. Allvaret i en sådan överträdelse ska självklart återspeglas i påföljden, vilket nu föreslås.",HA0983,
L,2024,hen,hen,"Den fråga som interpellanten tar upp om ett generellt och fullständigt förbud mot heltäckande slöja, hijab och andra värderingsstyrda plagg i Sverige är komplex och ger upphov till ett antal frågor om grundläggande fri- och rättigheter. Sverige ska vara ett fritt land, där det är självklart att var och en är fri att klä sig som hen själv vill utan att påtvingas andras värderingar. Ett undantagslöst förbud mot till exempel att bära ansiktstäckande plagg riskerar att komma i konflikt med bland annat religionsfriheten såväl i vår egen grundlag som i Europakonventionen samt principen om likabehandling.",HB0993,
L,2024,hen,hen,"Fru talman! Vem är jag, som inte är född i fel kropp, att säga till någon som är det att hen, som kanske har vetat sedan hen var fem år gammal att det som är här uppe inte stämmer överens med det som är här nere, att de fyra sista siffrorna i personnumret eller vad det står i passet inte är en av de viktigaste sakerna på jorden? Fru talman!",HB09100,
L,2025,hen,hen,Fru talman! Jag noterar ett mönster i den här debatten som i så många andra debatter: När den som lyssnar inte får höra det som hen önskar få höra är svaret att det inte kommer några förslag. Sanningen är den att det är de förslag som den borgerliga regeringen lägger fram som Socialdemokraterna inte tycker om.,HC0955,
M,2014,hen,hen,"Då säger infrastrukturministern att vi ska ha en sådan person, det vill säga att det i akt och mening handlar om att lägga ned flygplatser, försämra tillgängligheten, minska konkurrensen mellan flygbolag och få en sämre turtäthet och egentligen högre priser och svårare för företag och jobb ute i landet. I svaret omnämns förhandlingspersonen och vad hen ska arbeta med senare. Men då får man vara tydlig med att en sådan person inte jobbar på ett företags, en organisations och inte ens på en kommuns uppdrag utan faktiskt på regeringens uppdrag.",H20911,
M,2014,hen,hen,"Då är ju svaret på frågan uppfyllt, och då kommer vi tillbaka till huvudfrågan: Om det skulle slå så hårt mot företag och jobb i hela landet, kommer du alltjämt att kunna arbeta för att lägga ned Bromma flygplats, ja eller nej? När det gäller en förhandlingsperson kan man strikt formellt säga att hen inte kommer att jobba med att lägga ned flygplatsen fysiskt eller själv fatta beslutet, för det måste regeringen göra, sett till riksintresse och sådant. Men vi kommer ändå tillbaka till frågan vad denna person har för uppdrag.",H20911,
M,2014,hen,hen,"Då säger infrastrukturministern att vi ska ha en sådan person, det vill säga att det i akt och mening handlar om att lägga ned flygplatser, försämra tillgängligheten, minska konkurrensen mellan flygbolag och få en sämre turtäthet och egentligen högre priser och svårare för företag och jobb ute i landet. I svaret omnämns förhandlingspersonen och vad hen ska arbeta med senare. Men då får man vara tydlig med att en sådan person inte jobbar på ett företags, en organisations och inte ens på en kommuns uppdrag utan faktiskt på regeringens uppdrag.",H20911,
M,2014,hen,hen,"Då är ju svaret på frågan uppfyllt, och då kommer vi tillbaka till huvudfrågan: Om det skulle slå så hårt mot företag och jobb i hela landet, kommer du alltjämt att kunna arbeta för att lägga ned Bromma flygplats, ja eller nej? När det gäller en förhandlingsperson kan man strikt formellt säga att hen inte kommer att jobba med att lägga ned flygplatsen fysiskt eller själv fatta beslutet, för det måste regeringen göra, sett till riksintresse och sådant. Men vi kommer ändå tillbaka till frågan vad denna person har för uppdrag.",H20911,
M,2015,hen,hen,"Jag kan ha synpunkter på avgiftsstrukturen i de här kommunerna, men jag tror inte att det är något man löser genom att pumpa in statliga pengar till dem som redan har. Samtidigt ska en särskild utredare ta fram förslag till nationell strategi för den kommunala kultur- och musikskolan, men hen ska inte vara klar förrän den 30 september nästa år. Hade det inte varit rimligt att först reda ut vad man vill innan man lägger 100 miljoner på det?",H30940,
M,2016,hen,hen,"Alla vi som lever i ett öppet och demokratiskt samhälle är betjänta av denna granskning, oavsett om vi själva tittar eller lyssnar på själva programmet där granskningen utförs. Även den som inte upplever att hen konsumerar public service är beroende av att public service finns och fungerar. Fru ålderspresident!",H30962,
M,2017,hens,hens,"Det är ett exempel. När skolkatalogerna delades ut i slutet av höstterminen 2016 upptäckte en elev med skyddad identitet att hens namn och bild fanns med i katalogen. Man försökte då samla in alla de drygt 1 200 exemplaren, men 53 kataloger är fortfarande på villovägar.",H40993,
M,2017,hens,hens,"Då är den ju inte skyddad längre, för då är de blottade i sin tillvaro. I en skola i Skåne, tror jag, upptäckte en elev med skyddad identitet när skolkatalogerna delades ut i slutet av höstterminen 2016 att hens namn och bild fanns med i katalogen. Så snart felet uppdagades stoppades utskicket av katalogerna, och då hade 352 av drygt 1 200 exemplar skickats ut.",H409107,
M,2017,hens,hens,"I januari 2017 hade 299 av dem lämnats tillbaka, men 53 kataloger är fortfarande på villovägar. När denna person och hens familj får veta att katalogen är ute och alla ser att hen finns med där måste de bära på en fruktansvärd rädsla. På tal om våld i nära relationer avslöjades i Helsingborgs tingsrätt en kvinnas nya namn för före detta maken, trots att hon hade skyddad identitet.",H409107,
M,2017,hen,hen,"I januari 2017 hade 299 av dem lämnats tillbaka, men 53 kataloger är fortfarande på villovägar. När denna person och hens familj får veta att katalogen är ute och alla ser att hen finns med där måste de bära på en fruktansvärd rädsla. På tal om våld i nära relationer avslöjades i Helsingborgs tingsrätt en kvinnas nya namn för före detta maken, trots att hon hade skyddad identitet.",H409107,
M,2018,hens,hens,"Jag tycker att den som motsätter sig dödshjälp, som säger nej, som ministern nu tyvärr verkar göra här, och inte är beredd att ens lyfta på stenen och utreda frågan faktiskt måste svara på frågorna om varför människors rätt till självbestämmande så kraftigt begränsas vid livets slut. Varför ska inte också den som snart ska dö, den som lider av fruktansvärd smärta och ångest, få möjlighet att själv avgöra hur hens liv ska avslutas? Det tycker jag faktiskt att man måste besvara om man inte ens är beredd att utreda frågan.",H50963,
M,2019,hen,hen,Herr talman! Jag och ministern är helt överens om att det mest grundläggande i det här arbetet är att stå upp för alla människors lika värde och individens frihet att vara den hen är. Det är det mest grundläggande i detta.,H60961,
M,2022,hen,hen,"Jag har blivit sparkad på benet av en elev som jag var tvungen att hålla fast för att hen skulle slå en annan elev, sa en lärare. En annan lärare vittnade: Sparkad, slagen, fått glasögonen slängda av elev, biten, haft elever som sagt att hen ska döda mig. Jag har blivit slagen, biten, sparkad på.",H90958,
M,2024,hen,hen,"Vårdgarantin syftar till att korta väntetiderna i vården genom krav på regionerna att tillhandahålla vård inom vissa tidsgränser. Det innebär i stora drag att en person ska få en första kontakt med vården samma dag som hen söker vård, få en medicinsk bedömning inom tre dagar, besök i specialistvården inom 90 dagar och planerad vård inom 90 dagar från det att vårdgivaren fattat beslut om det. Här arbetar regeringen för att ge bättre förutsättningar för regioner och kommuner att förbättra tillgängligheten i hälso- och sjukvården, bland annat genom att öka vårdens kapacitet och antalet disponibla vårdplatser.",HB09106,
M,2026,hen,Hen,"Vi har ju svenskar på några ställen runt om i Europa, hos alla de större faktiskt, så ni får gissa vem det var. Hen påpekade att det är bra att det görs stora regelförenklingar, men det kommer ju nya regler hela tiden – stoppa dem, gör ett moratorium för regler så att man får en chans att börja nysta i allt detta! Jag tror att det ligger mycket i det.",HD0972,
MP,2013,hen,hen,"Ingen migrantarbetare ska se sina mänskliga rättigheter kränkas i Sverige. Problemet för migranten är dock att veta vilka rättigheter hen har, eftersom vi inte har ratificerat migrantarbetarkonventionen trots att vi själva var med och arbetade fram den. I många länder hänvisar både arbetstagare och arbetsgivare med självklarhet till nämnda konvention, som ju har samma innebörd på alla språk.",H00997,
MP,2014,hen,hen,Jämställdhet Jämställdhet Många män har varit passiva eller gjort motstånd i debatten och inte sett feminism som en frigörelse även för dem. Att varje människa kan få vara den hen är utan att låsas in i stereotypa könsnormer är en vinst för alla. Det är hög tid att diskutera mansnormer och maskulinitet.,H10978,
MP,2014,hen,hen,Även om det har kommit signaler om en ny praxis finns ännu exempel på arbetslösa som nekats a-kassa på grund av uppdrag i just sociala företag. Regelverket bör förtydligas så att en anställd i ett socialt företag ska kunna få a-kassa vid arbetslöshet även om hen sitter i styrelsen eller tecknar företagets firma. Herr talman!,H10994,
MP,2017,hen,hen,"Jag menar inte att det inte ska finnas en kontinuerlig utvärdering av kunskap – långt därifrån. Jag anser dock att den ska meddelas på ett sådant sätt att den gynnar den unga elevens utveckling, stimulerar nyfikenheten och ger strategier för hur hen ska komma åt den åtråvärda kunskapen och ta sig vidare. I denna process måste såklart vårdnadshavaren vara involverad.",H40976,
MP,2017,hen,hen,"Det handlar om att slippa göra de allra svåraste prioriteringarna men ändå inte ta så stora resurser i anspråk för hälso- och sjukvården att platser riskerar att stå outnyttjade ibland. Den andra metoden för den enskilde att försöka gardera sig så att hen har tillgång till den bästa möjliga vården är att köpa in sig i ett annat kollektiv av möjliga vårdbehövande än det stora offentliga, som omfattar alla. Tanken med en sådan lösning är att man delar kostnaderna med personer som inte förväntas ha så stora vårdbehov i framtiden eller som har möjlighet att lägga in avsevärt högre belopp i gruppens gemensamma vårdkassa än den avsättning som det är möjligt att avkräva medborgare för den kassa som ska stå till allas gemensamma förfogande.",H409108,
MP,2018,hen,hen,I propositionen föreslås till exempel nya regler om närvaro av vittne när visitering genomförs. Den intagna ges även möjlighet att välja någon i personalen som hen upplever som minst obekväm att bli visiterad av. Avsikten är att minimera risken att personalen förlorar det förtroende som man eventuellt lyckats bygga upp med dem man arbetar med.,H509116,
MP,2018,hen,hen,"Därför är det viktigt att förskolepersonalen har goda förutsättningar för att arbeta pedagogiskt med barnen. En förutsättning är att den som ska leda verksamheten har en god utbildning i det uppdrag hen har, och därför blir jag förvånad när jag inser att C, L, KD och SD invänder mot att förskolechefer ska få rektors titel. Rektorstiteln ska följa på en utbildning som är enhetlig över landet.",H509135,
MP,2020,hen,hen,"Det är sådant som går rakt in i hjärtat. Inget barn i Sverige ska behöva tvivla på att hon, han eller hen är lika mycket värd som andra. Alla barn är lika mycket värda.",H80928,
MP,2023,hen,hen,"Vården måste kunna attrahera nya medarbetare, och de som arbetar i vården ska vilja och orka jobba kvar. Varje gång en medarbetare börjar fundera på att byta jobb trots att hen egentligen tycker att det här är det allra bästa arbetet som hen hade kunnat välja eftersom hen inte står ut med de reella arbetsvillkoren är det ett allvarligt misslyckande. Herr talman!",HA0971,
MP,2023,hen,hen,"Om ett israeliskt barn kastar sten mot en palestinier i en bosättning hamnar hen i en civil domstol, med alla de rättigheter som det innebär, exempelvis rätt till juridiskt ombud. Om ett palestinskt barn i samma bosättning gör motsvarande hamnar hen i stället i en militär domstol, med obegränsad häktningstid och utan kontakt med föräldrar och juridiskt ombud före rättegång. På vilket sätt agerar regeringen för att bekämpa denna odemokratiska ordning och skydda de palestinier, i synnerhet barn, som faller offer för denna israeliska orättvisa?",HA0984,
